 ,Sub Topic,Description,Url
CLIMATE CHANGE,Global policy,"The 2019Scientists’ Warning of a Climate Emergency,signed by more than 13,000 scientists from around the world, explicitly calls for “bold and drastic transformations” regarding both economic and population policies, including making family planning services available to all and achieving full gender equity.Project Drawdownis a landmark, rolling study that evaluates practical and economically realistic solutions which can help control and reverse global warming. In 2022, it analysed 93 policy options, such as plant-based diets, wind farms and electric vehicles, and identifiedfamily planning and universal educationas  amongthe top 10 workable solutions to combat climate changeavailable.By helping to bend population growth down, Drawdown calculates that this joint solution would reduce CO2 emissions by68.9 gigatonnesby 2050 – more than onshore and offshore wind turbines combined.",CLIMATE CHANGE
CLIMATE CHANGE,A message for COP26 delegates,,CLIMATE CHANGE
CLIMATE CHANGE,Population action,"The world’s richest 10% of people are responsible for aroundhalf of all emissions. People choosing to havesmaller familiesin the richest parts of the world will have the greatest and most immediate positive effect – a vital choice given the urgency to address which climate change. Furthermore, reduced emissions as a result of fewer people being born in richer countries allows more economic development in poorer countries without adding to total emissions.",CLIMATE CHANGE
CLIMATE CHANGE,Population growth must be addressed in all countries to tackle climate change.,"Theethical, effective meansof achieving a sustainable population empower people and improve lives. Family planning, girls’ education and other measures toempower womenare not just essential for individuals’ wellbeing, but help communities and nations. Tackling poverty through greaterglobal justicefrees people from the conditions which often drive large family size, as well as helping to provide lives of dignity and security.In the Global North in particular, choosingsmaller familiescan be a vital part of the steps we take to reduce our emissions and impact. All these measures will help reduce family size and bring population growth to an end as soon as possible – giving us all the best chance of limiting climate change and protecting the next generation.",CLIMATE CHANGE
CLIMATE CHANGE,The climate crisis,"Further warming of our atmosphere is now impossible to avoid. The effects of that warming will depend on how high and how fast the temperature rises. Global warming changes weather patterns, causing severe weather events, heatwaves, droughts and floods.Climate change is already shrinking glaciers and ice caps, altering the availability of fresh water. It contributes to ocean acidification, destroying coral reefs and other aquatic ecosystems. It makes places uninhabitable for some plants and animals, leading to extinctions and redistribution of species, threatening food production with alien pests and diseases.For many people in the world, the impacts of climate change are already here: extreme weather events like the Australian bush fires and floods in Kenya devastate lives, while critical impacts on agriculture such as through soil degradation and unseasonal weather lead to unpredictable and unstable crop yields – especially dangerous for the poorest.Its potential human cost is catastrophic. A rise in sea levels threatens hundreds of millions of people incoastal communities and cities across the globe. Food and water shortages and conflict over productive land will arise, while progress in global health could be rolled back by communicable diseases such as malaria reaching places they never existed before. Hundreds of millions of people are likely to be forced to migrate from their homes by 2050.",https://populationmatters.org/climate-change/
CLIMATE CHANGE,Climate change action,"There are multiple drivers of the climate crisis, amongst which population is only one. Overwhelmingly, emissions are produced by people in the richest countries, and industrial development and consumption patterns in the Global North are primarily responsible for the crisis we are in today. Technological solutions,personal lifestyle changes, policies to end fossil fuel use and develop alternative energy and potentially fundamental changes toour economic sytemsare all vital, especially as the timescale for preventing catastrophic climate change is so short – now less than a decade, according to the IPCC.Whatever other changes we make, however, their positive impacts will be reduced and may even be completely cancelled out by adding emissions from hundreds of millions of new people as our population increases.According to2020 researchevaluating 44 countries, emissions arising as a result of population growth wiped out two-thirds of the reduction in emissions arising from greater energy efficiency between 1990 and 2019. Meanwhile, solutions such as reforestation may be more difficult to implement with more people needing food and land. In its landmark2018 report, the Intergovernmental Panel on Climate Change specifically identified high population growth as a “key impediment” to hitting the critical target of limiting global warming to 1.5°C above pre-industrial levels.Reducing the number of people being born is not a panacea for climate change, but it cuts future carbon emissions, effectively, simply and permanently, and it boosts the effectiveness of other solutions.Most importantly, it can be achieved through positive actions which empower people and improve lives.",https://populationmatters.org/climate-change/
CLIMATE CHANGE,Individual actions,"A study published in 2017 by the Universities of Lund and British Columbia suggested that the single most effective measure an individual in the Global North could take to cut their carbon emissions over the long term could be to have one fewer child. The study relied on estimates of future per capita climate emissions which are likely to change significantly, so it must be treated with caution. Illustrative figures produced by the authors suggested, however, that it could be significantly more effective than any other method in saving climate emissions. (For more information on the study and its methodology, clickhere.)All the benefits of this action are not immediate and it does not mean that we should not take other actions to cut our individual carbon footprints, of course.",https://populationmatters.org/climate-change/
CLIMATE CHANGE,Global policy,"The 2019Scientists’ Warning of a Climate Emergency,signed by more than 13,000 scientists from around the world, explicitly calls for “bold and drastic transformations” regarding both economic and population policies, including making family planning services available to all and achieving full gender equity.Project Drawdownis a landmark, rolling study that evaluates practical and economically realistic solutions which can help control and reverse global warming. In 2022, it analysed 93 policy options, such as plant-based diets, wind farms and electric vehicles, and identifiedfamily planning and universal educationas  amongthe top 10 workable solutions to combat climate changeavailable.By helping to bend population growth down, Drawdown calculates that this joint solution would reduce CO2 emissions by68.9 gigatonnesby 2050 – more than onshore and offshore wind turbines combined.",https://populationmatters.org/climate-change/
CLIMATE CHANGE,A message for COP26 delegates,,https://populationmatters.org/climate-change/
CLIMATE CHANGE,Population action,"The world’s richest 10% of people are responsible for aroundhalf of all emissions. People choosing to havesmaller familiesin the richest parts of the world will have the greatest and most immediate positive effect – a vital choice given the urgency to address which climate change. Furthermore, reduced emissions as a result of fewer people being born in richer countries allows more economic development in poorer countries without adding to total emissions.",https://populationmatters.org/climate-change/
CLIMATE CHANGE,Population growth must be addressed in all countries to tackle climate change.,"Theethical, effective meansof achieving a sustainable population empower people and improve lives. Family planning, girls’ education and other measures toempower womenare not just essential for individuals’ wellbeing, but help communities and nations. Tackling poverty through greaterglobal justicefrees people from the conditions which often drive large family size, as well as helping to provide lives of dignity and security.In the Global North in particular, choosingsmaller familiescan be a vital part of the steps we take to reduce our emissions and impact. All these measures will help reduce family size and bring population growth to an end as soon as possible – giving us all the best chance of limiting climate change and protecting the next generation.",https://populationmatters.org/climate-change/
